{
  "schema": "harness_replaybench.manifest.v1",
  "suite_id": "HRB-single-JeffLIrion__python-androidtv-351",
  "description": "Single-case HarnessReplayBench manifest split from formal-mix-8harness.json.",
  "path_base": "benchmark_root",
  "cases": [
    {
      "instance_id": "JeffLIrion__python-androidtv-351",
      "trace_file": "traces/upstream/JeffLIrion__python-androidtv-351.openhands-upstream.hrb-trace.json",
      "repo_dir": "repos/JeffLIrion__python-androidtv-351",
      "start_offset_ms": 0,
      "container_image": "swerebench/sweb.eval.x86_64.jefflirion_1776_python-androidtv-351"
    }
  ]
}
