{
  "schema": "harness_replaybench.manifest.v1",
  "suite_id": "HRB-2",
  "description": "Formal 2-harness colocated benchmark: one real mini-swe-agent SWE-bench trace plus one build-heavy breadth seed.",
  "path_base": "benchmark_root",
  "cases": [
    {
      "instance_id": "django__django-14608",
      "trace_file": "traces/local/django__django-14608.mini-swe-agent.hrb-trace.json",
      "repo_dir": "repos/django__django-14608",
      "start_offset_ms": 0
    },
    {
      "instance_id": "cxx-rust-build-heavy",
      "trace_file": "traces/repo-stage/cxx-rust-build-heavy.repo-stage.hrb-trace.json",
      "repo_dir": ".",
      "start_offset_ms": 250
    }
  ]
}
