{
  "schema": "harness_replaybench.manifest.v1",
  "suite_id": "HRB-single-django__django-14608",
  "description": "Single-case HarnessReplayBench manifest split from formal-mix-8harness.json.",
  "path_base": "benchmark_root",
  "cases": [
    {
      "instance_id": "django__django-14608",
      "trace_file": "traces/local/django__django-14608.mini-swe-agent.hrb-trace.json",
      "repo_dir": "repos/django__django-14608",
      "start_offset_ms": 0,
      "container_image": "swebench/sweb.eval.x86_64.django_1776_django-14608:latest"
    }
  ]
}
