{
  "schema": "harness_replaybench.manifest.v1",
  "suite_id": "HRB-3-REPO-STAGE",
  "description": "Three replay-validated repo-stage harness workloads for fast scheduler-agnostic smoke checks.",
  "path_base": "benchmark_root",
  "cases": [
    {
      "instance_id": "cxx-rust-build-heavy",
      "trace_file": "traces/repo-stage/cxx-rust-build-heavy.repo-stage.hrb-trace.json",
      "repo_dir": ".",
      "start_offset_ms": 0
    },
    {
      "instance_id": "python-test-straggler",
      "trace_file": "traces/repo-stage/python-test-straggler.repo-stage.hrb-trace.json",
      "repo_dir": ".",
      "start_offset_ms": 250
    },
    {
      "instance_id": "package-log-artifact-heavy",
      "trace_file": "traces/repo-stage/package-log-artifact-heavy.repo-stage.hrb-trace.json",
      "repo_dir": ".",
      "start_offset_ms": 500
    }
  ]
}
