{
  "schema": "harness_replaybench.manifest.v1",
  "suite_id": "HRB-8-docker-local",
  "description": "Formal 8-harness colocated benchmark variant: the two mini-swe-agent SWE-bench local traces run in their matching SWE-bench Docker images, three repo-stage breadth seeds run on host, and three replay-validated upstream OpenHands traces run in their SWE-rebench Docker images.",
  "path_base": "benchmark_root",
  "cases": [
    {
      "instance_id": "django__django-14608",
      "trace_file": "traces/local/django__django-14608.mini-swe-agent.hrb-trace.json",
      "repo_dir": "repos/django__django-14608",
      "start_offset_ms": 0,
      "container_image": "swebench/sweb.eval.x86_64.django_1776_django-14608:latest"
    },
    {
      "instance_id": "matplotlib__matplotlib-23314",
      "trace_file": "traces/local/matplotlib__matplotlib-23314.mini-swe-agent.hrb-trace.json",
      "repo_dir": "repos/matplotlib__matplotlib-23314",
      "start_offset_ms": 250,
      "container_image": "swebench/sweb.eval.x86_64.matplotlib_1776_matplotlib-23314:latest"
    },
    {
      "instance_id": "cxx-rust-build-heavy",
      "trace_file": "traces/repo-stage/cxx-rust-build-heavy.repo-stage.hrb-trace.json",
      "repo_dir": ".",
      "start_offset_ms": 750
    },
    {
      "instance_id": "python-test-straggler",
      "trace_file": "traces/repo-stage/python-test-straggler.repo-stage.hrb-trace.json",
      "repo_dir": ".",
      "start_offset_ms": 1000
    },
    {
      "instance_id": "package-log-artifact-heavy",
      "trace_file": "traces/repo-stage/package-log-artifact-heavy.repo-stage.hrb-trace.json",
      "repo_dir": ".",
      "start_offset_ms": 1250
    },
    {
      "instance_id": "tianocore__edk2-pytool-library-372",
      "trace_file": "traces/upstream/tianocore__edk2-pytool-library-372.openhands-upstream.hrb-trace.json",
      "repo_dir": "repos/tianocore__edk2-pytool-library-372",
      "start_offset_ms": 1500,
      "container_image": "swerebench/sweb.eval.x86_64.tianocore_1776_edk2-pytool-library-372"
    },
    {
      "instance_id": "JeffLIrion__python-androidtv-351",
      "trace_file": "traces/upstream/JeffLIrion__python-androidtv-351.openhands-upstream.hrb-trace.json",
      "repo_dir": "repos/JeffLIrion__python-androidtv-351",
      "start_offset_ms": 1750,
      "container_image": "swerebench/sweb.eval.x86_64.jefflirion_1776_python-androidtv-351"
    },
    {
      "instance_id": "PlasmaFAIR__sdf-xarray-24",
      "trace_file": "traces/upstream/PlasmaFAIR__sdf-xarray-24.openhands-upstream.hrb-trace.json",
      "repo_dir": "repos/PlasmaFAIR__sdf-xarray-24",
      "start_offset_ms": 2000,
      "container_image": "swerebench/sweb.eval.x86_64.plasmafair_1776_sdf-xarray-24"
    }
  ]
}
