{
  "schema": "harness_replaybench.manifest.v1",
  "suite_id": "HRB-single-cxx-rust-build-heavy",
  "description": "Single-case HarnessReplayBench manifest split from formal-mix-8harness.json.",
  "path_base": "benchmark_root",
  "cases": [
    {
      "instance_id": "cxx-rust-build-heavy",
      "trace_file": "traces/repo-stage/cxx-rust-build-heavy.repo-stage.hrb-trace.json",
      "repo_dir": ".",
      "start_offset_ms": 0
    }
  ]
}
